,URL,keywords,text
0,https://clicks.trackcb.com/aff_c?offer_id=55&aff_id=2051&source=bestcbdoils&url_id=305,cbd,Kanibi Full Spectrum CBD Oil is crafted from premium hemp and double-tested for purity. View all of Full Spectrum CBD Oil's flavors and strengths in the official store now.
1,https://plantpanda.com/?variant=32209254056076,cbd,PlantPanda
2,https://joyorganics.com/,cbd,"Joy Organics offers a variety of premium CBD products, including CBD tinctures, salves, gummies, softgels and more. Add Joy to your life today!"
3,https://clicks.trackcb.com/SHrZ,"Cbd.co, CBD Marketplace, cbd wholesale, CBD Brands, CBD co","CBD.co is the internet's premier CBD marketplace, offering the highest quality, lab-tested products across all the best brands. Shop with confidence!"
4,https://clicks.trackcb.com/SHra,"Cbd.co, CBD Marketplace, cbd wholesale, CBD Brands, CBD co","CBD.co is the internet's premier CBD marketplace, offering the highest quality, lab-tested products across all the best brands. Shop with confidence!"
5,https://www.elixinol.com/,"cbd products, buy cbd oil, cbd oil for sale, pure cbd oil, buy cbd online, elixinol cbd, effective cbd products, best cbd products, elixinol cbd","With more than 25 years of experience, Elixinol is the leading manufacturer of the highest quality hemp oil extracts and CBD products. Shop CBD products today."
6,https://fabcbd.com/,cbd,"Made from organically grown, lab tested, Colorado hemp. SHOP NOW Made from organically grown, lab tested, Colorado hemp. SHOP NOW SHOP OILS SHOP GUMMIES SHOP CREAM SHOP SALVE  5/5 Previous Next OILS GUMMIES CREAM SALVE DOG TREATS SUPERFOODS OILS GUMMIES CREAM SALVE DOG TREATS SUPERFOODS OILS GUMMIES CREAM SALVE DOG TREATS SUPERFOODS “These vegan […]"
7,https://bluebirdbotanicals.com/,cbd,Bluebird Botanicals (est. 2012) is an award winning Hemp Extract and CBD company. Our hemp is now being grown and processed in the great state of Colorado.
8,https://ilovegreengorilla.com/,cbd,"Green Gorilla is the most trusted source for USDA Certified Organic CBD. Shop organic cbd oil, full spectrum cbd oil, and pure cbd oil products."
9,https://cbdamericanshaman.com/,cbd,CBD American Shaman brings worldwide wellness through ultra-concentrated terpene rich CBD oil. Ships to all 50 States.
10,https://cbdfx.com/,cbd,"CBDfx is a market leader in the CBD industry and was founded on the belief that everyone should have access to the remarkable benefits of CBD. With thousands of happy customers, we are motivated to keep developing revolutionary products made with the best quality ingredients available."
11,https://takespruce.com/,cbd,Lab Grade CBD
12,https://greengardengold.com/,cbd,"Green Garden Gold provides the highest quality hemp-based CBD Oil on the market for people and pets alike. From extracts to edibles, capsules, gummies, and much more, we are your destination for the widest variety of CBD Oil products. Enjoy all the benefits and great effects that CBD Oil has to offer."
13,https://www.lazarusnaturals.com/,"Lazarus Naturals, CBD oli, CDB extracts","Lazarus Naturals is a trusted maker of high-quality CBD oils, tinctures and isolates. Our CBD extracts are made in-house, from plant to bottle."
14,https://www.thecbdistillery.com/,cbd,"Buy CBD Oil for Sale Online at CBDistillery, America's most trusted provider of hemp CBD, CBD Oil Isolate, and other CBD Products. Buy CBD Oil online."
15,https://purehempbotanicals.com/,cbd,"Pure Hemp Botanicals, Purity you can trust. Quality you can feel. Colorado's premier hemp extracts. Pure Hemp. Pure CBD. Pure Compassion."
16,https://4cornerscannabis.com/,cbd,"Whether you are looking for CBD products for your pets, your kids, your grandparents, or yourself, 4 Corners Cannabis is a brand you can trust."
17,https://missionfarmscbd.com/,cbd,"Mission Farms CBD provides premium products like CBD oils, gels, creams, mints, soaps, and bath soaks for powerful, targeted relief."
18,https://www.receptranaturals.com/,Receptra Naturals,"Receptra Naturals sells premium CBD products like oils, tinctures, and gummies made with organic Colorado hemp. Learn more now!"
19,https://nuleafnaturals.com/,cbd,Buy Organic & Pure CBD Oil at NuLeafNaturals.com. Discover the difference of NuLeaf's industry leading organic full spectrum CBD Oil & softgel capsules.
20,https://www.rebotanicals.com/,cbd,"U.S-grown, USDA certified organic CBD made from hemp. Industry leading organic products with a premium production process to give you the best products."
21,https://www.getsabaidee.com/,cbd,Shop our CBD Oil Selection at SabaiDee today! ✅ Get The Daily Relief You Deserve With Our 100% Organically Grown CBD Rich Hemp Extracts... ✅
22,https://www.purerelief.com/,cbd,"Pure Relief is your go to online source for lab-tested CBD Edibles, Oils, Topicals and other CBD solutions. Our products are trusted by thousands, worldwide."
23,https://populum.com/,cbd,"★ Populum offers the #1-rated high quality CBD oil. ★ Buy premium, full spectrum CBD oil. ★ Fully lab tested, 30 day risk-free trial, and fast, free shipping."
24,https://www.sagelynaturals.com/,cbd,Sagely Naturals provides plant-based CBD-infused products that support whole self wellness.
25,https://www.trythecbd.com/,cbd,"Buy CBD from Try The CBD store. All natural and organic Colorado CBD for Sale. Nature’s remedy, for optimal health. Serving you since 2015."
26,https://greenroads.com/,cbd,"Shop pharmacist-formulated, lab-tested CBD oils, topicals, edibles, beverages, spa goods & more from Green Roads, a pharmacist-founded, award-winning company."
27,https://medterracbd.com/,"cbd, medterra, medterra cbd, Medterra cbd, Medterra gel capsule, medterra hemp, medterra kentucky, medterra kentucky department, medterra oil, Medterra organic oil, medterra products, Medterra purest cbd oil, medterra purest oil, medterra registration, medterra usa, medterra vaporizer, medterra wholesale, medterra wholesale member, medterra zero thc","Medterra takes pride in providing our customers with the highest quality pure CBD, grown and processed in the USA."
28,https://www.moonmotherhemp.com/,cbd,"We offer organic, full spectrum CBD products including CBD balms, oils and supplements made with hemp extract from our family-owned, USDA-certified hemp farm."
29,https://hemplucid.com/,cbd,"Hemplucid sells premium CBD and USDA Organic CBD full spectrum, broad-spectrum, and isolate tinctures. Our high-quality CBD is derived from a top genetic hemp strain and infused in all our tinctures, topicals, gummies, soft gel capsules, body creams, and pet CBD products. Hemplucid is a high quality, proven brand."
